{
  "schema_version": "2.0.0",
  "project_id": "EPDM-V2-PHASE-A1-TUTORIAL",
  "evidence_ledger": [
    {
      "evidence_id": "EV-CATALYST",
      "status": "QUALIFIED",
      "source_type": "SYNTHETIC_FIXTURE",
      "source_id": "SRC-CATALYST-TUTORIAL",
      "locator": "Phase A1 deterministic software fixture",
      "dataset_id": null,
      "sha256": null,
      "notes": "Software contract fixture only; no scientific or engineering approval.",
      "applicability_domain_ids": [
        "AD-EPDM-TUTORIAL-1"
      ]
    },
    {
      "evidence_id": "EV-DIENE",
      "status": "QUALIFIED",
      "source_type": "SYNTHETIC_FIXTURE",
      "source_id": "SRC-DIENE-TUTORIAL",
      "locator": "Phase A1 deterministic software fixture",
      "dataset_id": null,
      "sha256": null,
      "notes": "Software contract fixture only; no scientific or engineering approval.",
      "applicability_domain_ids": [
        "AD-EPDM-TUTORIAL-1"
      ]
    },
    {
      "evidence_id": "EV-THERMO",
      "status": "QUALIFIED",
      "source_type": "SYNTHETIC_FIXTURE",
      "source_id": "SRC-THERMO-TUTORIAL",
      "locator": "Phase A1 deterministic software fixture",
      "dataset_id": null,
      "sha256": null,
      "notes": "Software contract fixture only; no scientific or engineering approval.",
      "applicability_domain_ids": [
        "AD-EPDM-TUTORIAL-1"
      ]
    },
    {
      "evidence_id": "EV-RATE",
      "status": "QUALIFIED",
      "source_type": "SYNTHETIC_FIXTURE",
      "source_id": "SRC-RATE-TUTORIAL",
      "locator": "Phase A1 deterministic software fixture",
      "dataset_id": null,
      "sha256": null,
      "notes": "Software contract fixture only; no scientific or engineering approval.",
      "applicability_domain_ids": [
        "AD-EPDM-TUTORIAL-1"
      ]
    },
    {
      "evidence_id": "EV-EA",
      "status": "QUALIFIED",
      "source_type": "SYNTHETIC_FIXTURE",
      "source_id": "SRC-EA-TUTORIAL",
      "locator": "Phase A1 deterministic software fixture",
      "dataset_id": null,
      "sha256": null,
      "notes": "Software contract fixture only; no scientific or engineering approval.",
      "applicability_domain_ids": [
        "AD-EPDM-TUTORIAL-1"
      ]
    },
    {
      "evidence_id": "EV-DATA",
      "status": "QUALIFIED",
      "source_type": "SYNTHETIC_FIXTURE",
      "source_id": "SRC-DATA-TUTORIAL",
      "locator": "Phase A1 deterministic software fixture",
      "dataset_id": null,
      "sha256": null,
      "notes": "Software contract fixture only; no scientific or engineering approval.",
      "applicability_domain_ids": [
        "AD-EPDM-TUTORIAL-1"
      ]
    },
    {
      "evidence_id": "EV-CASE",
      "status": "QUALIFIED",
      "source_type": "SYNTHETIC_FIXTURE",
      "source_id": "SRC-CASE-TUTORIAL",
      "locator": "Phase A1 deterministic software fixture",
      "dataset_id": null,
      "sha256": null,
      "notes": "Software contract fixture only; no scientific or engineering approval.",
      "applicability_domain_ids": [
        "AD-EPDM-TUTORIAL-1"
      ]
    }
  ],
  "applicability_domains": [
    {
      "applicability_domain_id": "AD-EPDM-TUTORIAL-1",
      "temperature_K": [
        298.15,
        373.15
      ],
      "pressure_Pa": [
        100000.0,
        5000000.0
      ],
      "ethylene_fraction": [
        0.0,
        1.0
      ],
      "propylene_fraction": [
        0.0,
        1.0
      ],
      "diene_fraction": [
        0.0,
        0.1
      ],
      "hydrogen_ratio": [
        0.0,
        0.2
      ],
      "reactor_types": [
        "BATCH",
        "SEMIBATCH",
        "CSTR",
        "SOLUTION_CSTR"
      ],
      "catalyst_ids": [
        "CAT-MET-TUTORIAL"
      ],
      "diene_ids": [
        "DIENE-ENB-TUTORIAL"
      ],
      "extensions": {}
    }
  ],
  "catalyst_passports": [
    {
      "catalyst_id": "CAT-MET-TUTORIAL",
      "display_name": "Synthetic metallocene tutorial catalyst",
      "family": "METALLOCENE",
      "site_model": "SINGLE_SITE",
      "metal": "Zr",
      "cocatalyst": "MAO",
      "catalyst_lot_id": null,
      "site_capacity": {
        "value": 0.6,
        "unit": "mol/kg",
        "basis": "synthetic fixture",
        "standard_uncertainty": null,
        "uncertainty_unit": null
      },
      "site_capacity_basis": "PER_MASS_CATALYST",
      "active_site_basis": "CALIBRATED",
      "simulator_component_status": "NOT_APPLICABLE",
      "applicability_domain_id": "AD-EPDM-TUTORIAL-1",
      "evidence_ids": [
        "EV-CATALYST"
      ],
      "extensions": {}
    }
  ],
  "diene_passports": [
    {
      "diene_id": "DIENE-ENB-TUTORIAL",
      "identity": "ENB",
      "canonical_name": "5-ethylidene-2-norbornene",
      "cas_number": "16219-75-3",
      "registry_version": "2.0.0",
      "molecular_weight": {
        "value": 0.12019,
        "unit": "kg/mol",
        "basis": "synthetic fixture",
        "standard_uncertainty": null,
        "uncertainty_unit": null
      },
      "repeat_segment_id": "SEG-ENB-1",
      "retained_double_bond_segment_id": "SEG-ENB-TDB-1",
      "second_insertion_supported": false,
      "terminal_model_supported": true,
      "thermo_parameter_source_id": "SRC-THERMO-ENB",
      "kinetic_parameter_source_id": "SRC-KIN-ENB",
      "applicability_domain_id": "AD-EPDM-TUTORIAL-1",
      "evidence_ids": [
        "EV-DIENE"
      ],
      "extensions": {}
    }
  ],
  "thermo_passports": [
    {
      "thermo_passport_id": "THERMO-TUTORIAL-1",
      "method_id": "REFERENCE-IDEAL-1",
      "method_family": "REFERENCE_IDEAL",
      "parameter_set_id": "THERMO-PARAM-TUTORIAL-1",
      "fitted_components": [
        "ETHYLENE",
        "PROPYLENE",
        "ENB",
        "SOLVENT"
      ],
      "temperature_range_K": [
        298.15,
        373.15
      ],
      "pressure_range_Pa": [
        100000.0,
        5000000.0
      ],
      "evidence_ids": [
        "EV-THERMO"
      ],
      "validation_dataset_ids": [
        "DS-THERMO-TUTORIAL"
      ],
      "backend_type": "REFERENCE_IDEAL",
      "simulator_version": null,
      "extensions": {}
    }
  ],
  "kinetic_parameter_sets": [
    {
      "parameter_set_id": "KPS-MET-ENB-TUTORIAL-1",
      "catalyst_id": "CAT-MET-TUTORIAL",
      "diene_id": "DIENE-ENB-TUTORIAL",
      "applicability_domain_id": "AD-EPDM-TUTORIAL-1",
      "rate_laws": [
        {
          "rate_law_id": "RL-PROP-E-1",
          "expression_id": "LIVE_SITE_TIMES_ETHYLENE",
          "reactant_orders": {
            "LIVE_SITE": 1.0,
            "ETHYLENE": 1.0
          },
          "concentration_basis": "MOLARITY",
          "rate_output_basis": "PER_REACTOR_VOLUME",
          "temperature_form": "ARRHENIUS_KREF",
          "parameter_roles": {
            "KP-E": "PROPAGATION_RATE",
            "EA-E": "ACTIVATION_ENERGY"
          }
        }
      ],
      "parameters": [
        {
          "parameter_id": "KP-E",
          "reaction_id": "RXN-PROP-E",
          "rate_law_id": "RL-PROP-E-1",
          "parameter_role": "PROPAGATION_RATE",
          "value": 0.002,
          "unit": "m^3/(mol*s)",
          "stored_quantity_kind": "K_REF",
          "reference_temperature_K": 323.15,
          "lower_bound": 1e-06,
          "upper_bound": 1.0,
          "evidence_id": "EV-RATE",
          "estimated": true,
          "scope": "GLOBAL",
          "maturity": "LAB_CALIBRATED",
          "applicability_domain_id": "AD-EPDM-TUTORIAL-1",
          "standard_error": 0.0001,
          "confidence_interval_95": [
            0.0018,
            0.0022
          ],
          "covariance_group_id": "COV-GROUP-1",
          "uncertainty_method": "synthetic fixture"
        },
        {
          "parameter_id": "EA-E",
          "reaction_id": "RXN-PROP-E",
          "rate_law_id": "RL-PROP-E-1",
          "parameter_role": "ACTIVATION_ENERGY",
          "value": 35000.0,
          "unit": "J/mol",
          "stored_quantity_kind": "ACTIVATION_ENERGY",
          "reference_temperature_K": null,
          "lower_bound": 10000.0,
          "upper_bound": 100000.0,
          "evidence_id": "EV-EA",
          "estimated": false,
          "scope": "GLOBAL",
          "maturity": "LITERATURE_PRIOR",
          "applicability_domain_id": "AD-EPDM-TUTORIAL-1",
          "standard_error": null,
          "confidence_interval_95": null,
          "covariance_group_id": null,
          "uncertainty_method": null
        }
      ],
      "evidence_ids": [
        "EV-RATE",
        "EV-EA"
      ],
      "extensions": {}
    }
  ],
  "state_definitions": [
    {
      "state_definition_id": "STATE-EXTENSIVE-L2-1",
      "version": "2.0.0",
      "basis": "EXTENSIVE_REACTOR_AMOUNT",
      "energy_formulation": "ISOTHERMAL",
      "variables": [
        {
          "variable_id": "N_E",
          "description": "ethylene amount",
          "unit": "mol",
          "basis": "EXTENSIVE_REACTOR_AMOUNT",
          "level_minimum": 1,
          "site_family_indexed": false,
          "terminal_indexed": false,
          "conserved_inventory_id": "INV-E"
        },
        {
          "variable_id": "N_P",
          "description": "propylene amount",
          "unit": "mol",
          "basis": "EXTENSIVE_REACTOR_AMOUNT",
          "level_minimum": 1,
          "site_family_indexed": false,
          "terminal_indexed": false,
          "conserved_inventory_id": "INV-P"
        },
        {
          "variable_id": "N_SITE_VACANT",
          "description": "vacant active sites",
          "unit": "mol",
          "basis": "EXTENSIVE_REACTOR_AMOUNT",
          "level_minimum": 2,
          "site_family_indexed": true,
          "terminal_indexed": false,
          "conserved_inventory_id": "INV-SITE"
        }
      ]
    }
  ],
  "reaction_networks": [
    {
      "schema": "TSAO-EPDM-V2-REACTION-NETWORK-1",
      "network_id": "EPDM-V2-TERMINAL-NETWORK-1",
      "version": "2.2.0",
      "model_level": 2,